{
  "schema": "xcodebuildmcp.output.build-result",
  "schemaVersion": "3",
  "didError": false,
  "error": null,
  "data": {
    "request": {
      "buildForTesting": true,
      "scheme": "CalculatorApp",
      "workspacePath": "example_projects/iOS_Calculator/CalculatorApp.xcworkspace",
      "derivedDataPath": "<TMPDIR>",
      "platform": "iOS",
      "target": "device",
      "testProductsPath": "<TMPDIR>/Generic CalculatorApp Tests.xctestproducts"
    },
    "summary": {
      "status": "SUCCEEDED",
      "durationMs": 1234,
      "target": "device"
    },
    "artifacts": {
      "buildLogPath": "~/Library/Developer/XcodeBuildMCP/workspaces/XcodeBuildMCP-<HASH>/logs/build_device_<TIMESTAMP>_pid<PID>.log",
      "testProductsPath": "<TMPDIR>/Generic CalculatorApp Tests.xctestproducts",
      "xctestrunPaths": [
        "<TMPDIR>/Generic CalculatorApp Tests.xctestproducts/Tests/0/CalculatorApp.xctestrun"
      ]
    },
    "diagnostics": {
      "warnings": [],
      "errors": []
    }
  }
}
