{
  "schema": "xcodebuildmcp.output.build-result",
  "schemaVersion": "3",
  "didError": false,
  "error": null,
  "data": {
    "request": {
      "scheme": "MCPTest",
      "projectPath": "example_projects/macOS/MCPTest.xcodeproj",
      "derivedDataPath": "<TMPDIR>/DerivedData",
      "platform": "macOS",
      "target": "macos"
    },
    "summary": {
      "status": "SUCCEEDED",
      "durationMs": 1234,
      "target": "macos"
    },
    "artifacts": {
      "bundleId": "io.sentry.MCPTest.macOS",
      "buildLogPath": "~/Library/Developer/XcodeBuildMCP/workspaces/XcodeBuildMCP-<HASH>/logs/build_macos_<TIMESTAMP>_pid<PID>.log"
    },
    "diagnostics": {
      "warnings": [],
      "errors": []
    }
  },
  "nextSteps": [
    "Get built macOS app path: xcodebuildmcp macos get-app-path --scheme MCPTest --derived-data-path <TMPDIR>/DerivedData"
  ]
}
