{
  "schema": "xcodebuildmcp.output.build-result",
  "schemaVersion": "3",
  "didError": false,
  "error": null,
  "data": {
    "summary": {
      "status": "SUCCEEDED",
      "durationMs": 1234,
      "target": "device"
    },
    "artifacts": {
      "buildLogPath": "~/Library/Developer/XcodeBuildMCP/workspaces/XcodeBuildMCP-<HASH>/logs/build_device_<TIMESTAMP>_pid<PID>.log"
    },
    "diagnostics": {
      "warnings": [],
      "errors": []
    }
  },
  "nextSteps": [
    "Get built device app path: get_device_app_path({ scheme: \"CalculatorApp\" })"
  ]
}
