{
  "schema": "xcodebuildmcp.output.build-result",
  "schemaVersion": "3",
  "didError": false,
  "error": null,
  "data": {
    "summary": {
      "status": "SUCCEEDED",
      "durationMs": 1234,
      "target": "macos"
    },
    "artifacts": {
      "bundleId": "io.sentry.MCPTest.macOS",
      "buildLogPath": "~/Library/Developer/XcodeBuildMCP/workspaces/XcodeBuildMCP-<HASH>/logs/build_macos_<TIMESTAMP>_pid<PID>.log"
    },
    "diagnostics": {
      "warnings": [],
      "errors": []
    }
  },
  "nextSteps": [
    "Get built macOS app path: get_mac_app_path({ scheme: \"MCPTest\", derivedDataPath: \"<TMPDIR>/DerivedData\" })"
  ]
}
