{
  "schema": "xcodebuildmcp.output.build-result",
  "schemaVersion": "3",
  "didError": false,
  "error": null,
  "data": {
    "request": {
      "buildForTesting": true,
      "scheme": "CalculatorApp",
      "workspacePath": "example_projects/iOS_Calculator/CalculatorApp.xcworkspace",
      "derivedDataPath": "<TMPDIR>",
      "platform": "iOS Simulator",
      "simulatorId": "<UUID>",
      "testProductsPath": "<TMPDIR>/CalculatorApp Tests.xctestproducts"
    },
    "summary": {
      "status": "SUCCEEDED",
      "durationMs": 1234,
      "target": "simulator"
    },
    "artifacts": {
      "buildLogPath": "~/Library/Developer/XcodeBuildMCP/workspaces/XcodeBuildMCP-<HASH>/logs/build_sim_<TIMESTAMP>_pid<PID>.log",
      "testProductsPath": "<TMPDIR>/CalculatorApp Tests.xctestproducts",
      "xctestrunPaths": [
        "<TMPDIR>/CalculatorApp Tests.xctestproducts/Tests/0/CalculatorApp.xctestrun"
      ]
    },
    "diagnostics": {
      "warnings": [],
      "errors": []
    }
  },
  "nextSteps": [
    "Run prepared tests: xcodebuildmcp simulator test --test-products-path '<TMPDIR>/CalculatorApp Tests.xctestproducts' --simulator-id <UUID>"
  ]
}
