{
  "schema": "xcodebuildmcp.output.build-result",
  "schemaVersion": "3",
  "didError": false,
  "error": null,
  "data": {
    "summary": {
      "status": "SUCCEEDED",
      "durationMs": 1234,
      "target": "macos"
    },
    "artifacts": {
      "buildLogPath": "~/Library/Developer/XcodeBuildMCP/workspaces/XcodeBuildMCP-<HASH>/logs/build_macos_<TIMESTAMP>_pid<PID>.log",
      "testProductsPath": "<TMPDIR>/MCPTest Tests.xctestproducts",
      "xctestrunPaths": [
        "<TMPDIR>/MCPTest Tests.xctestproducts/Tests/0/MCPTest.xctestrun"
      ]
    },
    "diagnostics": {
      "warnings": [],
      "errors": []
    }
  },
  "nextSteps": [
    "Run prepared tests: test_macos({ testProductsPath: \"<TMPDIR>/MCPTest Tests.xctestproducts\" })"
  ]
}
