{
  "schema": "xcodebuildmcp.output.build-result",
  "schemaVersion": "3",
  "didError": false,
  "error": null,
  "data": {
    "request": {
      "scheme": "CalculatorApp",
      "workspacePath": "example_projects/iOS_Calculator/CalculatorApp.xcworkspace",
      "derivedDataPath": "<TMPDIR>",
      "platform": "iOS",
      "target": "device"
    },
    "summary": {
      "status": "SUCCEEDED",
      "durationMs": 1234,
      "target": "device"
    },
    "artifacts": {
      "buildLogPath": "~/Library/Developer/XcodeBuildMCP/workspaces/XcodeBuildMCP-<HASH>/logs/build_device_<TIMESTAMP>_pid<PID>.log"
    },
    "diagnostics": {
      "warnings": [],
      "errors": []
    }
  },
  "nextSteps": [
    "Get built device app path: xcodebuildmcp device get-app-path --scheme CalculatorApp --derived-data-path <TMPDIR>"
  ]
}
