{
  "schema": "xcodebuildmcp.output.build-result",
  "schemaVersion": "3",
  "didError": false,
  "error": null,
  "data": {
    "request": {
      "buildForTesting": true,
      "scheme": "MCPTest",
      "projectPath": "example_projects/macOS/MCPTest.xcodeproj",
      "derivedDataPath": "<TMPDIR>/DerivedData",
      "platform": "macOS",
      "target": "macos",
      "testProductsPath": "<TMPDIR>/MCPTest Tests.xctestproducts"
    },
    "summary": {
      "status": "SUCCEEDED",
      "durationMs": 1234,
      "target": "macos"
    },
    "artifacts": {
      "buildLogPath": "~/Library/Developer/XcodeBuildMCP/workspaces/XcodeBuildMCP-<HASH>/logs/build_macos_<TIMESTAMP>_pid<PID>.log",
      "testProductsPath": "<TMPDIR>/MCPTest Tests.xctestproducts",
      "xctestrunPaths": [
        "<TMPDIR>/MCPTest Tests.xctestproducts/Tests/0/MCPTest.xctestrun"
      ]
    },
    "diagnostics": {
      "warnings": [],
      "errors": []
    }
  },
  "nextSteps": [
    "Run prepared tests: xcodebuildmcp macos test --test-products-path '<TMPDIR>/MCPTest Tests.xctestproducts'"
  ]
}
